{
  "$schema": "https://json-schema.org/draft/2020-12/schema",
  "title": "Graded reading texts batch",
  "type": "array",
  "minItems": 1,
  "items": {
    "type": "object",
    "additionalProperties": false,
    "required": ["id", "level", "title", "topic", "body"],
    "properties": {
      "id": { "type": "string", "pattern": "^text:(a2|b1|b2):[0-9]{2}$" },
      "level": { "enum": ["A2", "B1", "B2"] },
      "title": { "type": "string", "minLength": 3 },
      "topic": { "enum": ["everyday", "campus", "stem"] },
      "body": { "type": "string", "minLength": 300 }
    }
  }
}
