[
  {
    "id": "text:a2:01",
    "level": "A2",
    "title": "A Day at the Market",
    "topic": "everyday",
    "body": "Maria woke up early on Saturday morning and decided to go to the local market. She walked through the busy streets, greeting her neighbors along the way. At the market, she bought fresh vegetables, ripe fruit, and a loaf of warm bread from her favorite baker. The vendors were friendly and always gave her a good price because she visited every week. On her way home, she stopped at a small cafe for a cup of coffee and watched people passing by. It was a peaceful and simple morning that she truly enjoyed every single week without fail."
  }
]
